{
  "schemaVersion": "1.0.0",
  "appVersion": "1.0.0",
  "rubricVersion": "1.0.0",
  "metadata": {
    "assetName": "RelayBoard campaign brief hero",
    "assetVersion": "Test fixture v1",
    "reviewerType": "human",
    "reviewedAt": "2026-09-19T00:00:00.000Z",
    "audience": "Campaign operations managers at multi-region B2B companies",
    "journeyStage": "Problem aware",
    "buyingTrigger": "A launch is at risk because regional approvals are spread across email and spreadsheets",
    "alternatives": "Email threads, shared spreadsheets, project-management boards, or manual status meetings",
    "suppliedEvidence": "Fictional non-AI example created only to test N/A normalization."
  },
  "sourceMessaging": "Move every regional campaign approval into one accountable launch board.\n\nRelayBoard shows campaign operations managers which market, owner, and approval is blocking a launch. Replace status-chasing across email and spreadsheets with a shared decision trail before your next multi-region campaign goes live.",
  "dimensions": [
    {
      "id": "icp-specificity",
      "score": 4,
      "confidence": "high",
      "evidenceQuote": "campaign operations managers",
      "rationale": "The operating role and multi-region launch context are specific.",
      "missingContext": "Company maturity and campaign volume."
    },
    {
      "id": "problem-relevance",
      "score": 5,
      "confidence": "high",
      "evidenceQuote": "which market, owner, and approval is blocking a launch",
      "rationale": "The problem and its consequence are expressed in workflow terms.",
      "missingContext": "Evidence of how often this blocks launch."
    },
    {
      "id": "differentiation",
      "score": 4,
      "confidence": "medium",
      "evidenceQuote": "a shared decision trail",
      "rationale": "The decision trail distinguishes the offer from fragmented status tools, but the contrast is not proven.",
      "missingContext": "Direct comparison with project-management boards."
    },
    {
      "id": "value-articulation",
      "score": 4,
      "confidence": "high",
      "evidenceQuote": "Replace status-chasing across email and spreadsheets",
      "rationale": "The workflow mechanism and operational benefit are connected.",
      "missingContext": "A validated outcome beyond reduced status-chasing."
    },
    {
      "id": "clarity",
      "score": 5,
      "confidence": "high",
      "evidenceQuote": "one accountable launch board",
      "rationale": "The category, workflow, and value can be understood quickly.",
      "missingContext": "No material clarity gap in this short asset."
    },
    {
      "id": "evidence-and-credibility",
      "score": 3,
      "confidence": "medium",
      "evidenceQuote": "before your next multi-region campaign goes live",
      "rationale": "The message is proportionate but offers no customer or product evidence.",
      "missingContext": "Customer proof or demonstrated product behavior."
    },
    {
      "id": "narrative-consistency",
      "score": 4,
      "confidence": "high",
      "evidenceQuote": "regional campaign approval",
      "rationale": "The audience, approval problem, and launch-board mechanism remain aligned.",
      "missingContext": "A sharper reason to believe could reinforce the narrative."
    },
    {
      "id": "responsible-ai-claims",
      "score": null,
      "confidence": "not-applicable",
      "evidenceQuote": "",
      "rationale": "The asset makes no AI claim, so this dimension is not applicable.",
      "missingContext": ""
    }
  ],
  "summary": {
    "priorityFindings": [
      "Keep the role, launch moment, and approval blockage explicit.",
      "Prove the shared-decision-trail advantage against project-management boards.",
      "Add one bounded customer or product proof point."
    ],
    "riskyClaims": [],
    "nextTest": "Ask six campaign operations managers to compare this message with their current launch-control process and name what they believe RelayBoard replaces.",
    "humanNotes": "Fictional non-AI fixture used to test N/A normalization."
  },
  "manualReview": {
    "status": "reviewed"
  },
  "calculation": {
    "score": 84.4,
    "applicableWeight": 90,
    "excludedDimensionIds": [
      "responsible-ai-claims"
    ],
    "criticalFlagCodes": []
  }
}
